{"schemaVersion":"1.0","sessionId":"advisory-session","taskContractId":"advisory-task","snapshots":[{"shadowSequence":9,"triggeringGateOutcomeId":"gate-out-2","advisorySourceDigest":"e281342a77c1b94ae7c7539205052ecf6825c1c122f5d4060ac21cf0b8196a42","recommendation":"insufficient-evidence","classification":"insufficient-evidence"}],"realDecision":null,"finalRecommendation":"insufficient-evidence","aligned":null,"generatedAt":"1970-01-01T00:00:00.0000000Z","sourceDigest":"db8351809bdaf07c850ea19c8ebbd76c139859f8705b8886a083f37b22a64b61"}
